Name,Type,License,Self-Hosted,Open-Source,Best-For,Key-Features,Language-Support,GitHub-Stars,Documentation-Quality
LaunchDarkly,Commercial,Proprietary,Optional,No,Enterprise experimentation,"Real-time flags, 25+ SDKs, RBAC, SSO, A/B testing",25+ languages,N/A,Excellent
Split.io,Commercial,Proprietary,Optional,No,Monitoring + experimentation,"Real-time monitoring, traffic segmentation, analytics",Multiple,N/A,Good
Optimizely,Commercial,Proprietary,No,No,Enterprise A/B testing,"Comprehensive A/B testing, 80+ integrations, multivariate",Multiple,N/A,Excellent
Kameleoon,Commercial,Proprietary,No,No,AI-driven optimization,"80+ integrations, AI audience targeting, omnichannel",Multiple,N/A,Good
Statsig,Commercial,Proprietary,No,No,High-scale warehouse-native,"1+ trillion events, sequential testing, warehouse-native",Multiple,N/A,Excellent
DevCycle,Commercial,Proprietary,No,No,Developer experience,"Real-time control, environment flags, risk reduction",Multiple,N/A,Good
Datadog,Commercial,Proprietary,No,No,Observability-integrated,"Native observability, real-time management, canary rollouts",Multiple,N/A,Good
ConfigCat,Commercial,Proprietary,No,No,Developer simplicity,"Offline-first caching, fast SDKs, simple pricing",Multiple,N/A,Excellent
Flagsmith,Hybrid,MIT,Yes,Yes,Deployment flexibility,"Open-source core, cloud/self-hosted, A/B testing, config",Go Java .NET JS,6000,Excellent
Unleash,Open-Source,BSL,Yes,Yes,Infrastructure control,"Intuitive UI, Docker, Kubernetes scaling, multi-environment",Multiple,High,Excellent
FeatBit,Open-Source,MIT,Yes,Yes,Modern open-source,"User segments, scheduled flags, A/B testing, data export",JS .NET Java Go Python,N/A,Good
GrowthBook,Open-Source,MIT,Yes,Yes,A/B testing focus,"Experimentation framework, self-hosting, 7k stars",JS Python Ruby Go,7000,Good
Flipt,Open-Source,MIT,Yes,Yes,Minimal overhead,"Lightweight, stateless, <50MB memory, thousands of flags",Go Python JS,N/A,Good
flagd,Open-Source,Apache 2.0,Yes,Yes,OpenFeature compliance,"OpenFeature reference, multiple sources, Kubernetes sidecar",Multiple,779,Good
GO Feature Flag,Open-Source,MIT,Yes,Yes,Go-focused,"Gradual rollouts, user targeting, A/B testing",Go,1800,Good
Flagr,Open-Source,Apache 2.0,Yes,Yes,Microservice architecture,"A/B testing, dynamic configuration, microservices",Go,2500,Good
PostHog,Open-Source,MIT,Yes,Yes,Analytics integration,"Feature flags + analytics, real-time monitoring, free version",Multiple,High,Excellent
FeatureHub,Open-Source,Mixed,Yes,Yes,Self-hosted management,"Self-hosting, optional managed hosting, feature management",Multiple,N/A,Good
VWO,Commercial,Proprietary,No,No,Visual testing,"Visual editor, VWO FullStack, no-code testing",Multiple,N/A,Good
AB Tasty,Commercial,Proprietary,No,No,Omnichannel experimentation,"Web + mobile + devices, EmotionsAI, multivariate",Multiple,N/A,Good
Omniconvert,Commercial,Proprietary,No,No,Advanced segmentation,"40+ parameters, A/B testing, personalization, popups",Multiple,N/A,Good
Amplitude Experiment,Commercial,Proprietary,No,No,Warehouse-native analytics,"Behavioral cohorts, retention tracking, warehouse integration",Multiple,N/A,Good
Eppo,Commercial,Proprietary,No,No,Developer + statistics,"Advanced stats, warehouse-native, sequential testing",Multiple,N/A,Good
Userpilot,Commercial,Proprietary,No,No,Visual insights,"Heatmaps, session recordings, A/B testing",Multiple,N/A,Good
Crazy Egg,Commercial,Proprietary,No,No,User behavior visualization,"Session recordings, heatmaps, form analytics",Multiple,N/A,Good
Firebase Remote Config,Commercial,Proprietary,No,No,Mobile/Firebase apps,"Simple, integrated with Firebase, free tier",Multiple,N/A,Good
IBM Cloud App Config,Commercial,Proprietary,No,No,IBM ecosystem,"Centralized management, IBM CD toolchain integration",Multiple,N/A,Good
GitLab CI,Built-in,Proprietary,Yes,Partial,GitLab-native teams,"Native in GitLab CI/CD, integrated management",N/A,N/A,Good
JetBrains TeamCity,Built-in,Proprietary,Yes,No,TeamCity users,"Built-in feature flag support in CI/CD",N/A,N/A,Good
Harness,Commercial,Proprietary,No,No,Progressive delivery,"Feature flags, deployment orchestration, progressive delivery",Multiple,N/A,Excellent
CloudBees,Commercial,Proprietary,No,No,Jenkins/Enterprise,"Jenkins-integrated, progressive delivery, enterprise",Multiple,N/A,Excellent
