Name,Type,Provider,Category,License,Deployment,Key Features,Best For,Cost Model,Cloud Support,OSS,Notes
AWS Secrets Manager,Cloud Service,Amazon,Cloud Secrets,Proprietary,AWS Only,"Automatic rotation, multi-region replication, IAM integration, Secrets Insights",AWS-centric organizations,Per secret + API calls,AWS Only,No,Native AWS integration
Azure Key Vault,Cloud Service,Microsoft,Cloud Secrets,Proprietary,Azure Only,"HSM support, access logging, Key Vault Guardian, integrated security",Azure ecosystem,Per API call,Azure Only,No,Enterprise-grade encryption
GCP Secret Manager,Cloud Service,Google,Cloud Secrets,Proprietary,GCP Only,"Secret versioning, Insights analytics, usage tracking",GCP users,Per secret/month,GCP Only,No,Real-time analytics
HashiCorp Vault,Self-Managed,HashiCorp,Platform,Business Source License,Self-hosted,"Dynamic secrets, policies, encryption, multi-cloud, plugin architecture",Enterprise/multi-cloud,Free OSS / Enterprise pricing,Multiple,Yes (BSL),Steep learning curve
CyberArk Conjur,Commercial,CyberArk,Platform,Proprietary,Self-hosted,"Container-native, CI/CD optimized, anomaly detection, compliance",Regulated enterprises,Custom pricing,Multiple,No,Strong for PAM
Infisical,Platform,Infisical,Platform,MIT,Self-hosted/Cloud,"End-to-end encryption, versioning, rotation, UI, CI/CD integrations",Development teams,Free/OSS or $99+/month,Multiple,Yes,Developer-friendly
Akeyless Vault Platform,Commercial,Akeyless,Platform,Proprietary,SaaS,"Distributed Fragments Cryptography, zero-trust, dynamic secrets, multi-cloud",Multi-cloud teams,Free tier / Enterprise,Multiple,No,Eliminates master key
Doppler,Cloud Service,Doppler,Platform,Proprietary,Cloud Only,"Real-time syncing, developer CLI, GitHub/Vercel integration, rotation",Startups/developers,Free tier / $99+/month,Multiple,No,Excellent UX
Keeper Secrets Manager,Commercial,Keeper,Platform,Proprietary,Cloud,"Zero-trust architecture, DevOps integrations, GitHub/Jenkins/K8s",DevOps teams,Custom pricing,Multiple,No,FedRAMP authorized
1Password Business,Commercial,1Password,Password Manager,Proprietary,Cloud,"Machine learning, team sharing, audit logs, integrations",Enterprises with 1Password adoption,Custom pricing,Cloud,No,Password + secrets
EnvKey,Development Tool,EnvKey,Env Management,Proprietary,Cloud/Self,"Environment-specific config, role-based access, audit logs",Multi-environment teams,Custom pricing,Cloud/Self,No,Focus on .env management
Mozilla SOPS,Open-source,Mozilla,Encryption Tool,Mozilla Public License,Self-hosted,"Git-encrypted secrets, KMS backends (AWS/GCP/Azure/PGP), CLI",DevOps/GitOps,Free,Multiple,Yes,Version control friendly
Kubernetes Sealed Secrets,Open-source,Bitnami,K8s Controller,Apache 2.0,Kubernetes,"Per-cluster encryption, GitOps-friendly, automatic decryption",Kubernetes clusters,Free,Kubernetes,Yes,Works with Flux/ArgoCD
Vaultwarden,Open-source,Community,Password Manager,AGPL v3,Self-hosted,"Bitwarden-compatible, end-to-end encryption, team sharing, Docker",Personal/small teams,Free,Self-hosted,Yes,Lightweight Bitwarden
Keywhiz,Open-source,Square,Secrets,Apache 2.0,Self-hosted,"System-level secrets, ACL access, audit logging, Java-based",Java applications,Free,Self-hosted,Yes,Enterprise-grade
CredStash,Open-source,Fugal,AWS Secrets,MIT,AWS,"AWS KMS encryption, DynamoDB storage, CLI, audit trails",AWS teams,Free (AWS KMS/DynamoDB costs),AWS,Yes,Simple AWS-native solution
GitGuardian,Commercial,GitGuardian,Secret Scanning,Proprietary,Cloud,"450+ detectors, real-time scanning, CI/CD integration, VS Code",Enterprise scanning,Custom pricing / Free tier,Cloud,No,Industry-leading detection
TruffleHog,Open-source,Truffle Security,Secret Scanning,AGPL v3,Self-hosted,"Entropy + regex analysis, deep Git history, GitHub integration, ML",Development teams,Free,Self-hosted,Yes,High accuracy with entropy
GitLeaks,Open-source,GitLeaks,Secret Scanning,MIT,Self-hosted,"Fast CLI, pre-commit hooks, custom rules, 450+ patterns, multi-OS",Developers/CI/CD,Free,Self-hosted,Yes,Easy to integrate
GitHub Advanced Security,Platform-native,GitHub,Secret Scanning,Proprietary,GitHub Only,"Native integration, community patterns, PR alerts, custom patterns (Enterprise)",GitHub users,Included / per-seat,GitHub,No,GitHub-only
Legit Security,Commercial,Legit,ASPM,Proprietary,Cloud,"AI/ML detection, reduced false positives, supply chain security",Enterprise,Custom pricing,Cloud,No,AI-powered reduction of noise
Aikido,Commercial,Aikido,ASPM,Proprietary,Cloud,"Multi-tool integration, SAST + secrets + SCA, centralized dashboard",Security teams,Custom pricing,Cloud,No,Unified platform
Snyk,Commercial,Snyk,Security Platform,Proprietary,Cloud,"Secret scanning, dependency scanning, IaC scanning, remediation",Development teams,Free / Enterprise,Cloud,No,Developer-first approach
Aqua Security,Commercial,Aqua,Container Security,Proprietary,Cloud,"Secrets in images, runtime threat protection, compliance, supply chain",Container teams,Custom pricing,Cloud,No,Container-native
Thycotic Secret Server,Commercial,Thycotic,PAM,Proprietary,On-premise,"On-premise option, privileged session management, MFA, AD integration",Enterprises,Custom pricing,Self-hosted,No,Focus on privileged access
LastPass Enterprise,Commercial,LastPass,Password Manager,Proprietary,Cloud,"Password sharing, team admin, SSO/SAML, federated access",Enterprise,Custom pricing,Cloud,No,Password management focus
BeyondTrust Password Safe,Commercial,BeyondTrust,PAM,Proprietary,Self-hosted,"Privileged access, session recording, MFA, compliance reporting",Enterprise PAM,Custom pricing,Self-hosted,No,Comprehensive PAM
direnv,Open-source,direnv,Env Tool,MIT,Self-hosted,"Project-specific env vars, automatic loading, shell-agnostic, integration",Development teams,Free,Self-hosted,Yes,Works with secret managers
python-dotenv,Open-source,Saurabh Kumar,Env Tool,MIT,Self-hosted,"Load .env files, type casting, interpolation, simple API",Python development,Free,Self-hosted,Yes,Python-specific
JFrog Artifactory,Commercial,JFrog,Artifact Mgmt,Proprietary,Cloud/Self,"Artifact storage, secret scanning in artifacts, supply chain security",DevOps teams,Custom pricing,Cloud/Self,No,Artifact-focused
Vault Operator,Open-source,HashiCorp,K8s Operator,Apache 2.0,Kubernetes,"Automates Vault deployment, HA setup, auto-unsealing options",Kubernetes + Vault,Free,Kubernetes,Yes,Kubernetes integration
Sumo Logic,Commercial,Sumo Logic,SIEM,Proprietary,Cloud,"Secret detection in logs, security monitoring, compliance reporting, audit trails",Enterprise SOC,Custom pricing,Cloud,No,SIEM integration
Splunk,Commercial,Splunk,SIEM,Proprietary,Cloud/Self,"Secret detection, security monitoring, compliance, audit analysis, alerting",Enterprise SOC,Custom pricing,Cloud/Self,No,Enterprise SIEM
Google Cloud IAM,Cloud Service,Google,Identity Management,Proprietary,GCP Only,"Service account management, identity federation, secret binding",GCP users,No additional cost,GCP,No,Native GCP integration
AWS Systems Manager Parameter Store,Cloud Service,Amazon,Config Management,Proprietary,AWS Only,"Parameter storage, version control, encryption, AWS integration",AWS teams,Per API call,AWS,No,Simpler than Secrets Manager
Nix Flakes,Open-source,NixOS,Env Management,MIT,Self-hosted,"Reproducible environments, declarative config, dependency management",Nix users,Free,Self-hosted,Yes,Complex but powerful
